{
  "schema_version": "1.0.0",
  "mapping_id": "kisa-2026-pc-control-sources",
  "version": "0.2.0",
  "status": "DRAFT",
  "guide": {
    "guide_id": "kisa-major-infrastructure-detailed-guide",
    "version": "2026",
    "source_sha256": "44fe393981b244147be6af7423d99dc15633c089fad0bcb296cbe2371dde812d",
    "required_catalog_status": "APPROVED"
  },
  "audit_pack": {
    "pack_profile": "KISA-2026-PC-MVP",
    "version": "0.6.0",
    "content_sha256": "5dff4604365e2eabcd310a1b74b6bde6e48b3c53177383e541865b5f32c292de",
    "current_status": "DRAFT"
  },
  "runtime_activation_allowed": false,
  "mappings": [
    {
      "control_id": "PC-01",
      "control_title": "비밀번호의 주기적 변경",
      "source_document_code": "KISA-2026-07-PC",
      "page_start": 555,
      "page_end": 556,
      "section_label": "PC-01 비밀번호의 주기적 변경",
      "mapping_status": "DRAFT"
    },
    {
      "control_id": "PC-02",
      "control_title": "비밀번호 관리정책 설정",
      "source_document_code": "KISA-2026-07-PC",
      "page_start": 557,
      "page_end": 558,
      "section_label": "PC-02 비밀번호 관리정책 설정",
      "mapping_status": "DRAFT"
    },
    {
      "control_id": "PC-03",
      "control_title": "복구 콘솔에서 자동 로그온을 금지하도록 설정",
      "source_document_code": "KISA-2026-07-PC",
      "page_start": 559,
      "page_end": 560,
      "section_label": "PC-03 복구 콘솔에서 자동 로그온을 금지하도록 설정",
      "mapping_status": "DRAFT"
    },
    {
      "control_id": "PC-04",
      "control_title": "공유 폴더 제거",
      "source_document_code": "KISA-2026-07-PC",
      "page_start": 561,
      "page_end": 565,
      "section_label": "PC-04 공유 폴더 제거",
      "mapping_status": "DRAFT"
    },
    {
      "control_id": "PC-05",
      "control_title": "불필요한 서비스 제거",
      "source_document_code": "KISA-2026-07-PC",
      "page_start": 566,
      "page_end": 569,
      "section_label": "PC-05 불필요한 서비스 제거",
      "mapping_status": "DRAFT"
    },
    {
      "control_id": "PC-06",
      "control_title": "비인가 상용 메신저 사용 금지",
      "source_document_code": "KISA-2026-07-PC",
      "page_start": 570,
      "page_end": 570,
      "section_label": "PC-06 비인가 상용 메신저 사용 금지",
      "mapping_status": "DRAFT"
    },
    {
      "control_id": "PC-07",
      "control_title": "파일 시스템이 NTFS 포맷으로 설정",
      "source_document_code": "KISA-2026-07-PC",
      "page_start": 571,
      "page_end": 572,
      "section_label": "PC-07 파일 시스템이 NTFS 포맷으로 설정",
      "mapping_status": "DRAFT"
    },
    {
      "control_id": "PC-08",
      "control_title": "대상 시스템이 Windows 서버를 제외한 다른 OS로 멀티 부팅이 가능하지 않도록 설정",
      "source_document_code": "KISA-2026-07-PC",
      "page_start": 573,
      "page_end": 574,
      "section_label": "PC-08 대상 시스템이 Windows 서버를 제외한 다른 OS로 멀티 부팅이 가능하지 않도록 설정",
      "mapping_status": "DRAFT"
    },
    {
      "control_id": "PC-09",
      "control_title": "브라우저 종료 시 임시 인터넷 파일 폴더의 내용을 삭제하도록 설정",
      "source_document_code": "KISA-2026-07-PC",
      "page_start": 575,
      "page_end": 576,
      "section_label": "PC-09 브라우저 종료 시 임시 인터넷 파일 폴더의 내용을 삭제하도록 설정",
      "mapping_status": "DRAFT"
    },
    {
      "control_id": "PC-10",
      "control_title": "주기적 보안 패치 및 벤더 권고사항 적용",
      "source_document_code": "KISA-2026-07-PC",
      "page_start": 577,
      "page_end": 578,
      "section_label": "PC-10 주기적 보안 패치 및 벤더 권고사항 적용",
      "mapping_status": "DRAFT"
    },
    {
      "control_id": "PC-11",
      "control_title": "지원이 종료되지 않은 Windows OS Build 적용",
      "source_document_code": "KISA-2026-07-PC",
      "page_start": 579,
      "page_end": 579,
      "section_label": "PC-11 지원이 종료되지 않은 Windows OS Build 적용",
      "mapping_status": "DRAFT"
    },
    {
      "control_id": "PC-12",
      "control_title": "Windows 자동 로그인 점검",
      "source_document_code": "KISA-2026-07-PC",
      "page_start": 580,
      "page_end": 581,
      "section_label": "PC-12 Windows 자동 로그인 점검",
      "mapping_status": "DRAFT"
    },
    {
      "control_id": "PC-13",
      "control_title": "바이러스 백신 프로그램 설치 및 주기적 업데이트",
      "source_document_code": "KISA-2026-07-PC",
      "page_start": 582,
      "page_end": 583,
      "section_label": "PC-13 바이러스 백신 프로그램 설치 및 주기적 업데이트",
      "mapping_status": "DRAFT"
    },
    {
      "control_id": "PC-14",
      "control_title": "바이러스 백신 프로그램에서 제공하는 실시간 감시 기능 활성화",
      "source_document_code": "KISA-2026-07-PC",
      "page_start": 584,
      "page_end": 584,
      "section_label": "PC-14 바이러스 백신 프로그램에서 제공하는 실시간 감시 기능 활성화",
      "mapping_status": "DRAFT"
    },
    {
      "control_id": "PC-15",
      "control_title": "OS에서 제공하는 침입차단 기능 활성화",
      "source_document_code": "KISA-2026-07-PC",
      "page_start": 585,
      "page_end": 586,
      "section_label": "PC-15 OS에서 제공하는 침입차단 기능 활성화",
      "mapping_status": "DRAFT"
    },
    {
      "control_id": "PC-16",
      "control_title": "화면보호기 대기 시간 설정 및 재시작 시 암호 보호 설정",
      "source_document_code": "KISA-2026-07-PC",
      "page_start": 587,
      "page_end": 588,
      "section_label": "PC-16 화면보호기 대기 시간 설정 및 재시작 시 암호 보호 설정",
      "mapping_status": "DRAFT"
    },
    {
      "control_id": "PC-17",
      "control_title": "이동식 미디어 자동실행 방지 및 보안대책 수립",
      "source_document_code": "KISA-2026-07-PC",
      "page_start": 589,
      "page_end": 590,
      "section_label": "PC-17 이동식 미디어 자동실행 방지 및 보안대책 수립",
      "mapping_status": "DRAFT"
    },
    {
      "control_id": "PC-18",
      "control_title": "원격 지원을 금지하도록 정책을 설정",
      "source_document_code": "KISA-2026-07-PC",
      "page_start": 591,
      "page_end": 592,
      "section_label": "PC-18 원격 지원을 금지하도록 정책을 설정",
      "mapping_status": "DRAFT"
    }
  ]
}
